{
  "contract_type": "房屋租赁",
  "stance": "乙方",
  "industry": "个人租赁",
  "amount": 60000,
  "jurisdiction": "上海",
  "focus_areas": ["违约责任", "争议管辖"],
  "include_suggestion": true,
  "include_negotiation_strategy": true,
  "include_version_diff": false,
  "language": "zh-CN",
  "case_id": "demo-2026-contract-001",
  "contract_text": "甲方(出租方): 张某, 身份证号 310000199001011234\n乙方(承租方): 李某\n\n第一条 租赁标的\n甲方将位于上海市浦东新区某某路 123 号 1502 室房屋(以下简称'该房屋')出租给乙方使用。建筑面积 85 平方米。\n\n第二条 租赁期限\n租赁期自 2026 年 7 月 1 日起至 2027 年 6 月 30 日止, 共 12 个月。\n\n第三条 租金及支付\n月租金为人民币 5000 元整, 乙方应于每月 5 日前支付下月租金。逾期支付的, 每逾期一天, 按月租金的 5% 加收违约金。\n\n第四条 押金\n乙方向甲方支付押金人民币 10000 元整。租赁期满或合同提前终止后, 甲方应在扣除应由乙方承担的费用后 30 日内无息退还押金。\n\n第五条 维修责任\n租赁期间, 房屋及附属设施的维修责任由甲方承担。乙方使用不当造成的损坏由乙方负责赔偿。\n\n第六条 提前解约\n任何一方提前解除合同的, 须向守约方支付相当于 6 个月租金的违约金。\n\n第七条 争议管辖\n因本合同发生的争议, 双方协商不成的, 任何一方均可向甲方住所地人民法院提起诉讼。"
}